{
  "schemaVersion": "2.0",
  "expectationId": "catalog-a639142c",
  "scenario": "internal-forms-workspace@4",
  "catalogSha256": "a639142c4fa4ce82c1fe843a82a9e94094160a70644fe34b79629c0e3c03dc22",
  "compositions": [
    "api_baseline",
    "browser_bff",
    "forms_runtime"
  ],
  "packages": [
    "npm:@orbyss-io/forms-contracts@0.2.0",
    "npm:@orbyss-io/forms-jsonforms-runtime@0.2.0",
    "npm:@orbyss-io/forms-react@0.2.0",
    "npm:@orbyss-io/forms-renderer-registry@0.2.0",
    "nuget:Orbyss.Forms.Abstractions@0.2.0",
    "nuget:Orbyss.Forms.JsonForms@0.2.0",
    "nuget:Orbyss.Forms.Localization@0.2.0",
    "nuget:Orbyss.Forms.Web.Runtime@0.2.0",
    "nuget:Orbyss.Foundation.Analyzers@0.2.2",
    "nuget:Orbyss.Foundation.Authentication@0.2.2",
    "nuget:Orbyss.Foundation.Authentication.BffCookie@0.2.2",
    "nuget:Orbyss.Foundation.Web.OpenApi@0.2.2",
    "nuget:Orbyss.Foundation.Web.ProblemDetails@0.2.2",
    "nuget:Orbyss.Foundation.WebDefaults@0.2.2",
    "nuget:Orbyss.Localization.Abstractions@0.1.1",
    "nuget:Orbyss.Localization.Runtime@0.1.1",
    "nuget:Orbyss.Localization.Web.Runtime@0.1.1",
    "oci:ghcr.io/orbyss-io/foundation-host@0.2.2"
  ],
  "preservedDependencies": [
    "nuget:Microsoft.OpenApi@2.7.5",
    "npm:@jsonforms/core@3.8.0",
    "npm:@jsonforms/react@3.8.0",
    "npm:@types/react-dom@19.2.7",
    "npm:@types/react@19.2.18",
    "npm:react-dom@19.2.8",
    "npm:react@19.2.8",
    "npm:typescript@7.0.2"
  ],
  "targets": [
    "Directory.Build.props",
    "hostsettings.json",
    "shells.json",
    "src/InternalForms.Api/InternalForms.Api.csproj",
    "src/InternalForms.Bff/InternalForms.Bff.csproj",
    "src/InternalForms.Forms/InternalForms.Forms.csproj",
    "web/package.json"
  ],
  "minimumActivations": 10,
  "configurationKnowledge": [
    "Foundation:Web:Audience",
    "Foundation:Web:Authority",
    "Foundation:Web:ClientId",
    "Foundation:Web:ClientSecret",
    "Foundation:Web:DiscoveryTimeoutSeconds",
    "Foundation:Web:RemoteAuthenticationTimeoutSeconds"
  ]
}
