{
  "schemaVersion": "2.0",
  "expectationId": "catalog-c5a214cb",
  "scenario": "equipment-lending-bootstrap@1",
  "catalogSha256": "c5a214cb1c3fa0d6b0d1d526671e8fb1cc39c5d4a18b09132e71fa035c3386f5",
  "compositions": [
    "api_baseline",
    "json_profiles",
    "forms_immutable_release"
  ],
  "packages": [
    "npm:@orbyss-io/forms-ajv-build@0.2.0",
    "npm:@orbyss-io/forms-contracts@0.2.0",
    "npm:@orbyss-io/forms-jsonforms-runtime@0.2.0",
    "npm:@orbyss-io/forms-react@0.2.0",
    "npm:@orbyss-io/forms-renderer-registry@0.2.0",
    "nuget:Orbyss.Forms.Abstractions@0.2.0",
    "nuget:Orbyss.Forms.JsonForms@0.2.0",
    "nuget:Orbyss.Forms.Management@0.2.0",
    "nuget:Orbyss.Forms.Storage.Abstractions@0.2.0",
    "nuget:Orbyss.Forms.Storage.InMemory@0.2.0",
    "nuget:Orbyss.Foundation.Analyzers@0.2.0",
    "nuget:Orbyss.Foundation.Json.AspNetCore@0.2.0",
    "nuget:Orbyss.Foundation.Json@0.2.0",
    "nuget:Orbyss.Foundation.Web.OpenApi@0.2.0",
    "nuget:Orbyss.Foundation.Web.ProblemDetails@0.2.0",
    "nuget:Orbyss.Foundation.WebDefaults@0.2.0",
    "oci:ghcr.io/orbyss-io/foundation-host@0.2.0"
  ],
  "preservedDependencies": [],
  "targets": [
    "Directory.Build.props",
    "src/Lending.Api/Lending.Api.csproj",
    "tools/Lending.Forms.Build/Lending.Forms.Build.csproj",
    "web/package.json",
    "shells.json",
    "hostsettings.json"
  ],
  "minimumActivations": 4,
  "configurationKnowledge": []
}
